Name,URL_1080,URL_720,URL_480,Status
مسلسل Behind Her Eyes الموسم الاول الحلقة 5 الخامسة                                                                                                                                                 2021,,,,Broken
فيلم Project Hail Mary 2026 مترجم اون لاين                                                                                                                                                 2026,,,,Broken
فيلم The Super Mario Galaxy Movie 2026 مترجم اون                                                                                                                                                 2026,,,,Broken
مسلسل العميل تشيه هان Agent from Above الحلقة 1                                                                                                                                                 2026,,,,Broken
انمي Shunkashuutou Daikousha: Haru no Mai الحلقة 4 مترجمة                                                                                                                                                 2026,,,,Broken
فيلم The Boys مترجم                                                                                                                                                 2022,,,,Broken
فيلم The Drama 2026 مترجم اون لاين                                                                                                                                                 2026,,,,Broken
مسلسل اسمي تشاو وودي My Name is Zhao Wudi:                                                                                                                                                 2026,,,,Broken
فيلم Ballistic 2026 مترجم                                                                                                                                                 2026,,,,Broken
مسلسل ازهار الشر The Flowers of Evil الحلقة 2                                                                                                                                                 2026,,,,Broken
انمي Shunkashuutou Daikousha: Haru no Mai الحلقة 4 مترجمة     ( 2026  ),,,,Broken
مسلسل ازهار الشر The Flowers of Evil الحلقة 2     ( 2026  ),,,,Broken
مسلسل اسمي تشاو وودي My Name is Zhao Wudi:     ( 2026  ),,,,Broken
مسلسل اسمي تشاو وودي My Name is Zhao Wudi:     ( 2026  ),,,,Broken
مسلسل اسمي تشاو وودي My Name is Zhao Wudi:     ( 2026  ),,,,Broken
