Name,URL_1080,URL_720,URL_480,Status
مسلسل Marshals الموسم الاول الحلقة 7 مترجمة                                                                                                                                                 2026,,,,Broken
فيلم Project Hail Mary 2026 مترجم اون لاين                                                                                                                                                 2026,,,,Broken
مسلسل Tracker الموسم الثالث الحلقة 16 مترجمة                                                                                                                                                 2025,,,,Broken
مسلسل American Classic الموسم الاول الحلقة 8 مترجمة                                                                                                                                                 2026,,,,Broken
مسلسل اخي الموسم الاول الحلقة 57 مدبلجة                                                                                                                                                 2026,,,,Broken
فيلم Peaky Blinders: The Immortal Man 2026 مترجم اون                                                                                                                                                 2026,,,,Broken
انمي Tensei shitara Slime Datta Ken الموسم الرابع الحلقة                                                                                                                                                 2026,,,,Broken
فيلم The Super Mario Galaxy Movie 2026 مترجم اون                                                                                                                                                 2026,,,,Broken
Otonari no Tenshi-sama ni Itsunomanika Dame Ningen ni Sareteita                                                                                                                                                 2026,,,,Broken
فيلم Timur 2025 مترجم                                                                                                                                                 2025,,,,Broken
مسلسل Marshals الموسم الاول الحلقة 7 مترجمة     ( 2026  ),,,,Broken
مسلسل American Classic الموسم الاول الحلقة 8 مترجمة     ( 2026  ),,,,Broken
مسلسل Rooster الموسم الاول الحلقة 6 مترجمة     ( 2026  ),,,,Broken
مسلسل Tracker الموسم الثالث الحلقة 16 مترجمة     ( 2025  ),,,,Broken
مسلسل المنظمة الموسم السادس الحلقة 29 مترجمة     ( 2025  ),,,,Broken
